Trait_ID_6th,Category,Trait_name,Trait_description,,,,,,,,,,,,,,,,,,,,,,,,,,,,,,,,,,,,,,,,,,,,,,,,,,,,,,,,,,,,,,,,,,,,,,,,,,,,,,,,,,,,,,,,,,,,,,,,,,,,,,,,,,,,,
390,Law and Judicial Process,General amnesties granted on special occasions,General amnesties granted on special occasions,,,,,,,,,,,,,,,,,,,,,,,,,,,,,,,,,,,,,,,,,,,,,,,,,,,,,,,,,,,,,,,,,,,,,,,,,,,,,,,,,,,,,,,,,,,,,,,,,,,,,,,,,,,,,
391,Law and Judicial Process,Violation of secular law incurs punishment by gods and secular punishment ,"Violation of secular legal norms automatically incurs punishment by gods during the individual’s lifetime, as well as secular punishment by a formally designated agent of the society",,,,,,,,,,,,,,,,,,,,,,,,,,,,,,,,,,,,,,,,,,,,,,,,,,,,,,,,,,,,,,,,,,,,,,,,,,,,,,,,,,,,,,,,,,,,,,,,,,,,,,,,,,,,,
392,Warfare,Warfare for reasons beyond personal conflicts or preemptive defense,"Warfare initiated for considerations other than (or in addition to) the avenging of insults, personal injury, murder, witchcraft, the stealing of women, trespass, or forestalling an enemy attack",,,,,,,,,,,,,,,,,,,,,,,,,,,,,,,,,,,,,,,,,,,,,,,,,,,,,,,,,,,,,,,,,,,,,,,,,,,,,,,,,,,,,,,,,,,,,,,,,,,,,,,,,,,,,
393,Warfare,Economic reasons for warfare,"Economic considerations (e.g., territorial acquisition, the capture of booty, the taking of slaves) important in the initiation of warfare",,,,,,,,,,,,,,,,,,,,,,,,,,,,,,,,,,,,,,,,,,,,,,,,,,,,,,,,,,,,,,,,,,,,,,,,,,,,,,,,,,,,,,,,,,,,,,,,,,,,,,,,,,,,,
394,Warfare,Religious reasons for warfare,"Warfare initiated in order to impose religious dogma or to make religious observances (e.g., human sacrifice)",,,,,,,,,,,,,,,,,,,,,,,,,,,,,,,,,,,,,,,,,,,,,,,,,,,,,,,,,,,,,,,,,,,,,,,,,,,,,,,,,,,,,,,,,,,,,,,,,,,,,,,,,,,,,
395,Warfare,Formal warning or declaration of war,"Formal warning, challenges, or declaration of war, including the displaying of symbols, customarily given",,,,,,,,,,,,,,,,,,,,,,,,,,,,,,,,,,,,,,,,,,,,,,,,,,,,,,,,,,,,,,,,,,,,,,,,,,,,,,,,,,,,,,,,,,,,,,,,,,,,,,,,,,,,,
396,Warfare,War leaders,"Recognized war leader(s) (other than a political leader) who regularly leads the men of the society against the enemy (e.g., war chief, general)",,,,,,,,,,,,,,,,,,,,,,,,,,,,,,,,,,,,,,,,,,,,,,,,,,,,,,,,,,,,,,,,,,,,,,,,,,,,,,,,,,,,,,,,,,,,,,,,,,,,,,,,,,,,,
397,Warfare,Professional military commanders,"Professional military commanders (e.g., generals) who regularly lead the army in time of war",,,,,,,,,,,,,,,,,,,,,,,,,,,,,,,,,,,,,,,,,,,,,,,,,,,,,,,,,,,,,,,,,,,,,,,,,,,,,,,,,,,,,,,,,,,,,,,,,,,,,,,,,,,,,
398,Warfare,Professional middle-level military officials,"Professional middle-level military officials (e.g., centurions, lieutenants, captains)",,,,,,,,,,,,,,,,,,,,,,,,,,,,,,,,,,,,,,,,,,,,,,,,,,,,,,,,,,,,,,,,,,,,,,,,,,,,,,,,,,,,,,,,,,,,,,,,,,,,,,,,,,,,,
399,Warfare,Specially trained warriors,Body of specially trained or highly skilled warriors (as distinct from the rest of the fighting men),,,,,,,,,,,,,,,,,,,,,,,,,,,,,,,,,,,,,,,,,,,,,,,,,,,,,,,,,,,,,,,,,,,,,,,,,,,,,,,,,,,,,,,,,,,,,,,,,,,,,,,,,,,,,
400,Warfare,Standing army,"Standing army, organized around a core of professional soldiers, and continuously maintained",,,,,,,,,,,,,,,,,,,,,,,,,,,,,,,,,,,,,,,,,,,,,,,,,,,,,,,,,,,,,,,,,,,,,,,,,,,,,,,,,,,,,,,,,,,,,,,,,,,,,,,,,,,,,
401,Warfare,Militia,Militia: a semimilitary organization with officers who keep its units in readiness to quell uprisings or repel invasions,,,,,,,,,,,,,,,,,,,,,,,,,,,,,,,,,,,,,,,,,,,,,,,,,,,,,,,,,,,,,,,,,,,,,,,,,,,,,,,,,,,,,,,,,,,,,,,,,,,,,,,,,,,,,
402,Warfare,Military conscription,"Military conscription (those disinclined to fight either coerced into doing so, allowed to commute, or else subject to punishment)",,,,,,,,,,,,,,,,,,,,,,,,,,,,,,,,,,,,,,,,,,,,,,,,,,,,,,,,,,,,,,,,,,,,,,,,,,,,,,,,,,,,,,,,,,,,,,,,,,,,,,,,,,,,,
403,Warfare,Military or corvée obligations fulfilled through substitutes or payments,Substitutes may be hired or commutation paid to fulfill military or corvée obligations,,,,,,,,,,,,,,,,,,,,,,,,,,,,,,,,,,,,,,,,,,,,,,,,,,,,,,,,,,,,,,,,,,,,,,,,,,,,,,,,,,,,,,,,,,,,,,,,,,,,,,,,,,,,,
404,Warfare,Troops receive fixed pay,"Troops receive fixed pay (over and above, or instead of, a share of the booty)",,,,,,,,,,,,,,,,,,,,,,,,,,,,,,,,,,,,,,,,,,,,,,,,,,,,,,,,,,,,,,,,,,,,,,,,,,,,,,,,,,,,,,,,,,,,,,,,,,,,,,,,,,,,,
405,Warfare,Mercenaries,"Mercenaries (i.e., paid foreign troops) used in warfare",,,,,,,,,,,,,,,,,,,,,,,,,,,,,,,,,,,,,,,,,,,,,,,,,,,,,,,,,,,,,,,,,,,,,,,,,,,,,,,,,,,,,,,,,,,,,,,,,,,,,,,,,,,,,
406,Warfare,Soldiers take oath of allegiance,Soldiers or officers take oath of allegiance,,,,,,,,,,,,,,,,,,,,,,,,,,,,,,,,,,,,,,,,,,,,,,,,,,,,,,,,,,,,,,,,,,,,,,,,,,,,,,,,,,,,,,,,,,,,,,,,,,,,,,,,,,,,,
407,Warfare,Fighting force divided into subunits,Fighting force customarily divided into subunits,,,,,,,,,,,,,,,,,,,,,,,,,,,,,,,,,,,,,,,,,,,,,,,,,,,,,,,,,,,,,,,,,,,,,,,,,,,,,,,,,,,,,,,,,,,,,,,,,,,,,,,,,,,,,
408,Warfare,Army organized into military units,"Army organized into groups of units which are successively more inclusive (e.g., platoons, companies, regiments, divisions)",,,,,,,,,,,,,,,,,,,,,,,,,,,,,,,,,,,,,,,,,,,,,,,,,,,,,,,,,,,,,,,,,,,,,,,,,,,,,,,,,,,,,,,,,,,,,,,,,,,,,,,,,,,,,
409,Warfare,Organized war preparation drills and exercises,Organized drills or exercises carried out to prepare for war,,,,,,,,,,,,,,,,,,,,,,,,,,,,,,,,,,,,,,,,,,,,,,,,,,,,,,,,,,,,,,,,,,,,,,,,,,,,,,,,,,,,,,,,,,,,,,,,,,,,,,,,,,,,,
410,Warfare,Differentiated military units,"Differentiated military units (e.g., spearmen, bowmen, slingers, cavalry)",,,,,,,,,,,,,,,,,,,,,,,,,,,,,,,,,,,,,,,,,,,,,,,,,,,,,,,,,,,,,,,,,,,,,,,,,,,,,,,,,,,,,,,,,,,,,,,,,,,,,,,,,,,,,
411,Warfare,Cavalry,Cavalry,,,,,,,,,,,,,,,,,,,,,,,,,,,,,,,,,,,,,,,,,,,,,,,,,,,,,,,,,,,,,,,,,,,,,,,,,,,,,,,,,,,,,,,,,,,,,,,,,,,,,,,,,,,,,
412,Warfare,Military engineers,Military engineers,,,,,,,,,,,,,,,,,,,,,,,,,,,,,,,,,,,,,,,,,,,,,,,,,,,,,,,,,,,,,,,,,,,,,,,,,,,,,,,,,,,,,,,,,,,,,,,,,,,,,,,,,,,,,
413,Warfare,Baggage trains used to transport the army’s supplies,Baggage trains used to transport the army’s supplies,,,,,,,,,,,,,,,,,,,,,,,,,,,,,,,,,,,,,,,,,,,,,,,,,,,,,,,,,,,,,,,,,,,,,,,,,,,,,,,,,,,,,,,,,,,,,,,,,,,,,,,,,,,,,
414,Warfare,Pitched battles,"Pitched battles, involving considerable hand-to-hand fighting, initiated, in which the objective is to destroy or drive off the enemy fighting force, or capture (rather than merely raid) enemy settlements",,,,,,,,,,,,,,,,,,,,,,,,,,,,,,,,,,,,,,,,,,,,,,,,,,,,,,,,,,,,,,,,,,,,,,,,,,,,,,,,,,,,,,,,,,,,,,,,,,,,,,,,,,,,,
415,Warfare,Fighters begin battle in formation,Fighters begin battle in formation (including arrangement in a straight line),,,,,,,,,,,,,,,,,,,,,,,,,,,,,,,,,,,,,,,,,,,,,,,,,,,,,,,,,,,,,,,,,,,,,,,,,,,,,,,,,,,,,,,,,,,,,,,,,,,,,,,,,,,,,
416,Warfare,Soldiers fight as compact units,"Soldiers fight closely aligned or as compact units, rather than as separate individuals",,,,,,,,,,,,,,,,,,,,,,,,,,,,,,,,,,,,,,,,,,,,,,,,,,,,,,,,,,,,,,,,,,,,,,,,,,,,,,,,,,,,,,,,,,,,,,,,,,,,,,,,,,,,,
417,Warfare,Formal rules governing military conducts,Formal rules governing conduct of soldiers and officers in war,,,,,,,,,,,,,,,,,,,,,,,,,,,,,,,,,,,,,,,,,,,,,,,,,,,,,,,,,,,,,,,,,,,,,,,,,,,,,,,,,,,,,,,,,,,,,,,,,,,,,,,,,,,,,
418,Warfare,Government arsenals or armories,Arsenals or armories where government stockpiles of weapons are maintained ,,,,,,,,,,,,,,,,,,,,,,,,,,,,,,,,,,,,,,,,,,,,,,,,,,,,,,,,,,,,,,,,,,,,,,,,,,,,,,,,,,,,,,,,,,,,,,,,,,,,,,,,,,,,,
419,Warfare,Cutting or thrusting weapons used in warfare,Cutting or thrusting weapons used in warfare,,,,,,,,,,,,,,,,,,,,,,,,,,,,,,,,,,,,,,,,,,,,,,,,,,,,,,,,,,,,,,,,,,,,,,,,,,,,,,,,,,,,,,,,,,,,,,,,,,,,,,,,,,,,,
420,Warfare,Defensive body armor,Defensive body armor (exclude shields and helmets),,,,,,,,,,,,,,,,,,,,,,,,,,,,,,,,,,,,,,,,,,,,,,,,,,,,,,,,,,,,,,,,,,,,,,,,,,,,,,,,,,,,,,,,,,,,,,,,,,,,,,,,,,,,,
421,Warfare,Metal armor used in warfare,Metal armor used in warfare,,,,,,,,,,,,,,,,,,,,,,,,,,,,,,,,,,,,,,,,,,,,,,,,,,,,,,,,,,,,,,,,,,,,,,,,,,,,,,,,,,,,,,,,,,,,,,,,,,,,,,,,,,,,,
422,Warfare,Chariots used in warfare,Chariots used in warfare,,,,,,,,,,,,,,,,,,,,,,,,,,,,,,,,,,,,,,,,,,,,,,,,,,,,,,,,,,,,,,,,,,,,,,,,,,,,,,,,,,,,,,,,,,,,,,,,,,,,,,,,,,,,,
423,Warfare,Military emblems and banners,"Emblems, banners, or special objects which serve to identify military units, or act as rallying points, are carried into battle",,,,,,,,,,,,,,,,,,,,,,,,,,,,,,,,,,,,,,,,,,,,,,,,,,,,,,,,,,,,,,,,,,,,,,,,,,,,,,,,,,,,,,,,,,,,,,,,,,,,,,,,,,,,,
424,Warfare,Musical instruments used for battle signals,"Drums, horns, trumpets, etc., used to signal commands in battle or to encourage troops (excluding the use of these instruments merely to frighten the enemy)",,,,,,,,,,,,,,,,,,,,,,,,,,,,,,,,,,,,,,,,,,,,,,,,,,,,,,,,,,,,,,,,,,,,,,,,,,,,,,,,,,,,,,,,,,,,,,,,,,,,,,,,,,,,,
425,Warfare,Espionage ,"Espionage, by special agents who gather strategic information in foreign territory by hiding their purpose and/or identity but not their persons",,,,,,,,,,,,,,,,,,,,,,,,,,,,,,,,,,,,,,,,,,,,,,,,,,,,,,,,,,,,,,,,,,,,,,,,,,,,,,,,,,,,,,,,,,,,,,,,,,,,,,,,,,,,,
426,Warfare,Sieges laid to enemy fortifications,Sieges laid to enemy fortifications strong enough to resist immediate assault,,,,,,,,,,,,,,,,,,,,,,,,,,,,,,,,,,,,,,,,,,,,,,,,,,,,,,,,,,,,,,,,,,,,,,,,,,,,,,,,,,,,,,,,,,,,,,,,,,,,,,,,,,,,,
427,Warfare,Permanently garrisoned forts,"Permanently garrisoned forts (excluding observation posts, walled towns and cities)",,,,,,,,,,,,,,,,,,,,,,,,,,,,,,,,,,,,,,,,,,,,,,,,,,,,,,,,,,,,,,,,,,,,,,,,,,,,,,,,,,,,,,,,,,,,,,,,,,,,,,,,,,,,,
428,Warfare,Battering rams,Battering rams,,,,,,,,,,,,,,,,,,,,,,,,,,,,,,,,,,,,,,,,,,,,,,,,,,,,,,,,,,,,,,,,,,,,,,,,,,,,,,,,,,,,,,,,,,,,,,,,,,,,,,,,,,,,,
429,Warfare,Assault ladders or towers used in sieges,Assault ladders or towers used in sieges,,,,,,,,,,,,,,,,,,,,,,,,,,,,,,,,,,,,,,,,,,,,,,,,,,,,,,,,,,,,,,,,,,,,,,,,,,,,,,,,,,,,,,,,,,,,,,,,,,,,,,,,,,,,,
430,Warfare,Siege ramps,Siege ramps,,,,,,,,,,,,,,,,,,,,,,,,,,,,,,,,,,,,,,,,,,,,,,,,,,,,,,,,,,,,,,,,,,,,,,,,,,,,,,,,,,,,,,,,,,,,,,,,,,,,,,,,,,,,,
431,Warfare,Catapult-type devices used as siege engines,Catapult-type devices used as siege engines,,,,,,,,,,,,,,,,,,,,,,,,,,,,,,,,,,,,,,,,,,,,,,,,,,,,,,,,,,,,,,,,,,,,,,,,,,,,,,,,,,,,,,,,,,,,,,,,,,,,,,,,,,,,,
432,Warfare,Body trophies,"Body trophies (e.g., heads, scalps, hands) taken in war or from sacrificed prisoners",,,,,,,,,,,,,,,,,,,,,,,,,,,,,,,,,,,,,,,,,,,,,,,,,,,,,,,,,,,,,,,,,,,,,,,,,,,,,,,,,,,,,,,,,,,,,,,,,,,,,,,,,,,,,
433,Warfare,Military booty,Considerable booty taken during successful military campaigns,,,,,,,,,,,,,,,,,,,,,,,,,,,,,,,,,,,,,,,,,,,,,,,,,,,,,,,,,,,,,,,,,,,,,,,,,,,,,,,,,,,,,,,,,,,,,,,,,,,,,,,,,,,,,
434,Warfare,Adult male war captives,Adult males frequently taken captive in warfare,,,,,,,,,,,,,,,,,,,,,,,,,,,,,,,,,,,,,,,,,,,,,,,,,,,,,,,,,,,,,,,,,,,,,,,,,,,,,,,,,,,,,,,,,,,,,,,,,,,,,,,,,,,,,
435,Warfare,Cannibalism of war captives,Cannibalism of war captives,,,,,,,,,,,,,,,,,,,,,,,,,,,,,,,,,,,,,,,,,,,,,,,,,,,,,,,,,,,,,,,,,,,,,,,,,,,,,,,,,,,,,,,,,,,,,,,,,,,,,,,,,,,,,
436,Warfare,War captives regularly sacrificed to gods,War captives regularly sacrificed to god(s),,,,,,,,,,,,,,,,,,,,,,,,,,,,,,,,,,,,,,,,,,,,,,,,,,,,,,,,,,,,,,,,,,,,,,,,,,,,,,,,,,,,,,,,,,,,,,,,,,,,,,,,,,,,,
437,Warfare,War captives kept for ransom or held as hostages,War captives kept for ransom or held as hostages,,,,,,,,,,,,,,,,,,,,,,,,,,,,,,,,,,,,,,,,,,,,,,,,,,,,,,,,,,,,,,,,,,,,,,,,,,,,,,,,,,,,,,,,,,,,,,,,,,,,,,,,,,,,,
438,Warfare,Special ornaments for brave or wounded warriors,"Special ornaments, insignia, or appellations awarded for prowess or wounds received in battle",,,,,,,,,,,,,,,,,,,,,,,,,,,,,,,,,,,,,,,,,,,,,,,,,,,,,,,,,,,,,,,,,,,,,,,,,,,,,,,,,,,,,,,,,,,,,,,,,,,,,,,,,,,,,
439,Warfare,Rewards for outstanding warriors,"Outstanding warriors rewarded with gifts of property, women, or slaves, or appointment to official positions",,,,,,,,,,,,,,,,,,,,,,,,,,,,,,,,,,,,,,,,,,,,,,,,,,,,,,,,,,,,,,,,,,,,,,,,,,,,,,,,,,,,,,,,,,,,,,,,,,,,,,,,,,,,,
440,Warfare,Nobility attainable through war exploits,Nobility or distinctly high social status attainable through war exploits,,,,,,,,,,,,,,,,,,,,,,,,,,,,,,,,,,,,,,,,,,,,,,,,,,,,,,,,,,,,,,,,,,,,,,,,,,,,,,,,,,,,,,,,,,,,,,,,,,,,,,,,,,,,,
441,Warfare,"Penalty for cowardice, desertion, or insurrection","Death, confiscation of property, or other severe punishment may be penalty for cowardice in battle, desertion, or insurrection",,,,,,,,,,,,,,,,,,,,,,,,,,,,,,,,,,,,,,,,,,,,,,,,,,,,,,,,,,,,,,,,,,,,,,,,,,,,,,,,,,,,,,,,,,,,,,,,,,,,,,,,,,,,,
442,Warfare,Formal ceremonies to conclude inter-societal hostilities,Formal ceremonies (including the making of treaties) to conclude hostilities with other societies,,,,,,,,,,,,,,,,,,,,,,,,,,,,,,,,,,,,,,,,,,,,,,,,,,,,,,,,,,,,,,,,,,,,,,,,,,,,,,,,,,,,,,,,,,,,,,,,,,,,,,,,,,,,,
443,Warfare,Military prowess exhibited in parades or reviews,Military parades or reviews in which military skill and prowess are exhibited (excluding celebrations held for returning warriors),,,,,,,,,,,,,,,,,,,,,,,,,,,,,,,,,,,,,,,,,,,,,,,,,,,,,,,,,,,,,,,,,,,,,,,,,,,,,,,,,,,,,,,,,,,,,,,,,,,,,,,,,,,,,
444,Warfare,Territory of vanquished enemy annexed,Territory of vanquished enemy annexed,,,,,,,,,,,,,,,,,,,,,,,,,,,,,,,,,,,,,,,,,,,,,,,,,,,,,,,,,,,,,,,,,,,,,,,,,,,,,,,,,,,,,,,,,,,,,,,,,,,,,,,,,,,,,
445,Warfare,Vanquished enemies subjugated and controlled,Peoples of vanquished enemy subjugated and held under effective control,,,,,,,,,,,,,,,,,,,,,,,,,,,,,,,,,,,,,,,,,,,,,,,,,,,,,,,,,,,,,,,,,,,,,,,,,,,,,,,,,,,,,,,,,,,,,,,,,,,,,,,,,,,,,
446,Warfare,Defeated political leaders pledge allegiance to conquerors,Defeated political leader(s) or his relative(s) retained in authority over his territory on pledge of allegiance to conquerors,,,,,,,,,,,,,,,,,,,,,,,,,,,,,,,,,,,,,,,,,,,,,,,,,,,,,,,,,,,,,,,,,,,,,,,,,,,,,,,,,,,,,,,,,,,,,,,,,,,,,,,,,,,,,
447,Warfare,Indemnities exacted from defeated enemies,Indemnities or reparations (as distinct from tribute) exacted from defeated enemies,,,,,,,,,,,,,,,,,,,,,,,,,,,,,,,,,,,,,,,,,,,,,,,,,,,,,,,,,,,,,,,,,,,,,,,,,,,,,,,,,,,,,,,,,,,,,,,,,,,,,,,,,,,,,
448,Warfare,Permanent settlements built in conquered territory,Permanent settlements built in conquered territory,,,,,,,,,,,,,,,,,,,,,,,,,,,,,,,,,,,,,,,,,,,,,,,,,,,,,,,,,,,,,,,,,,,,,,,,,,,,,,,,,,,,,,,,,,,,,,,,,,,,,,,,,,,,,
449,Religion,Supernatural beings intervening for supplicants,Supernatural being(s) who currently intervenes for the benefit of suppliants,,,,,,,,,,,,,,,,,,,,,,,,,,,,,,,,,,,,,,,,,,,,,,,,,,,,,,,,,,,,,,,,,,,,,,,,,,,,,,,,,,,,,,,,,,,,,,,,,,,,,,,,,,,,,
450,Religion,Ancestral spirits propitiated and invoked,Ancestral spirits propitiated and invoked,,,,,,,,,,,,,,,,,,,,,,,,,,,,,,,,,,,,,,,,,,,,,,,,,,,,,,,,,,,,,,,,,,,,,,,,,,,,,,,,,,,,,,,,,,,,,,,,,,,,,,,,,,,,,
451,Religion,Gods,"God(s): specifically personified supernatural being(s) (not impersonal force) who is not particular to locations or to kinship segments (exclude, e.g., ancestral, guardian, and other personal spirits), to whom prayers are directed and who intervenes for the benefit of the society or its members",,,,,,,,,,,,,,,,,,,,,,,,,,,,,,,,,,,,,,,,,,,,,,,,,,,,,,,,,,,,,,,,,,,,,,,,,,,,,,,,,,,,,,,,,,,,,,,,,,,,,,,,,,,,,
452,Religion,Sun god ,"Sun god worshipped (i.e., propitiated and invoked)",,,,,,,,,,,,,,,,,,,,,,,,,,,,,,,,,,,,,,,,,,,,,,,,,,,,,,,,,,,,,,,,,,,,,,,,,,,,,,,,,,,,,,,,,,,,,,,,,,,,,,,,,,,,,
453,Religion,God of war,God of war (not necessarily connected exclusively with war) worshipped,,,,,,,,,,,,,,,,,,,,,,,,,,,,,,,,,,,,,,,,,,,,,,,,,,,,,,,,,,,,,,,,,,,,,,,,,,,,,,,,,,,,,,,,,,,,,,,,,,,,,,,,,,,,,
454,Religion,Lawgiver god,"Lawgiver god, who on more than one occasion has enunciated extensive rules for governing human conduct, worshipped",,,,,,,,,,,,,,,,,,,,,,,,,,,,,,,,,,,,,,,,,,,,,,,,,,,,,,,,,,,,,,,,,,,,,,,,,,,,,,,,,,,,,,,,,,,,,,,,,,,,,,,,,,,,,
455,Religion,Patron gods or saints,"Patron gods or saints (not including guardian spirits), who afford protection to groups of individuals engaged in particular occupations or activities (e.g., god of merchants, god of hunters, god of travelers, god of blacksmiths, god of war)",,,,,,,,,,,,,,,,,,,,,,,,,,,,,,,,,,,,,,,,,,,,,,,,,,,,,,,,,,,,,,,,,,,,,,,,,,,,,,,,,,,,,,,,,,,,,,,,,,,,,,,,,,,,,
456,Religion,Pantheon of gods,"Pantheon of gods worshipped (propitiated and invoked); (applies only to differentiated gods who actively control spheres of life or nature, e.g., rain god, war god, fire god, fertility goddess, love goddess)",,,,,,,,,,,,,,,,,,,,,,,,,,,,,,,,,,,,,,,,,,,,,,,,,,,,,,,,,,,,,,,,,,,,,,,,,,,,,,,,,,,,,,,,,,,,,,,,,,,,,,,,,,,,,
457,Religion,Paramount god in the pantheon  ,One god in the pantheon of differentiated gods worshipped as paramount,,,,,,,,,,,,,,,,,,,,,,,,,,,,,,,,,,,,,,,,,,,,,,,,,,,,,,,,,,,,,,,,,,,,,,,,,,,,,,,,,,,,,,,,,,,,,,,,,,,,,,,,,,,,,
458,Religion,Life and death affects the afterlife,Manner of living or dying affects the status or condition of the soul after death,,,,,,,,,,,,,,,,,,,,,,,,,,,,,,,,,,,,,,,,,,,,,,,,,,,,,,,,,,,,,,,,,,,,,,,,,,,,,,,,,,,,,,,,,,,,,,,,,,,,,,,,,,,,,
459,Religion,Offerings,Offerings (including libations and sacrifices),,,,,,,,,,,,,,,,,,,,,,,,,,,,,,,,,,,,,,,,,,,,,,,,,,,,,,,,,,,,,,,,,,,,,,,,,,,,,,,,,,,,,,,,,,,,,,,,,,,,,,,,,,,,,
460,Religion,Libations,"Libations: the ritual pouring, sprinkling, or drinking of a liquid",,,,,,,,,,,,,,,,,,,,,,,,,,,,,,,,,,,,,,,,,,,,,,,,,,,,,,,,,,,,,,,,,,,,,,,,,,,,,,,,,,,,,,,,,,,,,,,,,,,,,,,,,,,,,
461,Religion,Animal sacrifices,Animal sacrifices directed to supernatural beings to placate them or gain their favor,,,,,,,,,,,,,,,,,,,,,,,,,,,,,,,,,,,,,,,,,,,,,,,,,,,,,,,,,,,,,,,,,,,,,,,,,,,,,,,,,,,,,,,,,,,,,,,,,,,,,,,,,,,,,
462,Religion,Human sacrifice,Human sacrifice directed to supernatural beings to placate them or gain their favor,,,,,,,,,,,,,,,,,,,,,,,,,,,,,,,,,,,,,,,,,,,,,,,,,,,,,,,,,,,,,,,,,,,,,,,,,,,,,,,,,,,,,,,,,,,,,,,,,,,,,,,,,,,,,
463,Religion,Private worship of supernatural beings,"Private worship of supernatural beings through personally owned (rather than societally maintained) idols, altars, or shrines",,,,,,,,,,,,,,,,,,,,,,,,,,,,,,,,,,,,,,,,,,,,,,,,,,,,,,,,,,,,,,,,,,,,,,,,,,,,,,,,,,,,,,,,,,,,,,,,,,,,,,,,,,,,,
464,Religion,Priests perform private ceremonies for payment,Private ceremonies or sacrifices performed by priests (not shamans or medicine men) on behalf of individuals for payment,,,,,,,,,,,,,,,,,,,,,,,,,,,,,,,,,,,,,,,,,,,,,,,,,,,,,,,,,,,,,,,,,,,,,,,,,,,,,,,,,,,,,,,,,,,,,,,,,,,,,,,,,,,,,
465,Religion,Priests conduct sacrifices on behalf of the society,"Priests conduct sacrifices on behalf of the society, or a significant segment thereof, to ward off calamities, solicit benefits, or offer thanks",,,,,,,,,,,,,,,,,,,,,,,,,,,,,,,,,,,,,,,,,,,,,,,,,,,,,,,,,,,,,,,,,,,,,,,,,,,,,,,,,,,,,,,,,,,,,,,,,,,,,,,,,,,,,
466,Religion,Rites of passage performed by priests,Rites of passage performed by priests,,,,,,,,,,,,,,,,,,,,,,,,,,,,,,,,,,,,,,,,,,,,,,,,,,,,,,,,,,,,,,,,,,,,,,,,,,,,,,,,,,,,,,,,,,,,,,,,,,,,,,,,,,,,,
467,Religion,Rites to promote farming success,"Rites to promote fertility of the soil, to bring rain, or to celebrate the harvest performed seasonally (rather than merely when the crop is in danger)",,,,,,,,,,,,,,,,,,,,,,,,,,,,,,,,,,,,,,,,,,,,,,,,,,,,,,,,,,,,,,,,,,,,,,,,,,,,,,,,,,,,,,,,,,,,,,,,,,,,,,,,,,,,,
468,Religion,Thank offerings to supernatural beings,Thank offerings to supernatural being(s),,,,,,,,,,,,,,,,,,,,,,,,,,,,,,,,,,,,,,,,,,,,,,,,,,,,,,,,,,,,,,,,,,,,,,,,,,,,,,,,,,,,,,,,,,,,,,,,,,,,,,,,,,,,,
469,Religion,Pre-battle rituals performed by religious specialists,"Offerings, sacrifices, prayers, or other rituals carried out by religious specialists before battle",,,,,,,,,,,,,,,,,,,,,,,,,,,,,,,,,,,,,,,,,,,,,,,,,,,,,,,,,,,,,,,,,,,,,,,,,,,,,,,,,,,,,,,,,,,,,,,,,,,,,,,,,,,,,
470,Religion,Post-victory offerings to supernatural beings,Victory offerings made to supernatural being(s) after successful military campaign,,,,,,,,,,,,,,,,,,,,,,,,,,,,,,,,,,,,,,,,,,,,,,,,,,,,,,,,,,,,,,,,,,,,,,,,,,,,,,,,,,,,,,,,,,,,,,,,,,,,,,,,,,,,,
471,Religion,Housebuilding offerings or sacrifices,Offerings or sacrifices made in connection with housebuilding or the erection of other structures,,,,,,,,,,,,,,,,,,,,,,,,,,,,,,,,,,,,,,,,,,,,,,,,,,,,,,,,,,,,,,,,,,,,,,,,,,,,,,,,,,,,,,,,,,,,,,,,,,,,,,,,,,,,,
472,Religion,Religious pilgrimages,Religious pilgrimages to distant shrines or sacred places,,,,,,,,,,,,,,,,,,,,,,,,,,,,,,,,,,,,,,,,,,,,,,,,,,,,,,,,,,,,,,,,,,,,,,,,,,,,,,,,,,,,,,,,,,,,,,,,,,,,,,,,,,,,,
473,Religion,"Votive offerings, ceremonies or pilgrimages",Votive offerings or ceremonies or votive pilgrimages made,,,,,,,,,,,,,,,,,,,,,,,,,,,,,,,,,,,,,,,,,,,,,,,,,,,,,,,,,,,,,,,,,,,,,,,,,,,,,,,,,,,,,,,,,,,,,,,,,,,,,,,,,,,,,
474,Religion,Idols,Idols: durable representations made in the likeness of supernatural beings through or in which they are worshipped,,,,,,,,,,,,,,,,,,,,,,,,,,,,,,,,,,,,,,,,,,,,,,,,,,,,,,,,,,,,,,,,,,,,,,,,,,,,,,,,,,,,,,,,,,,,,,,,,,,,,,,,,,,,,
475,Religion,Oracles,"Oracles: shrines, places, or objects where, or by means of which, a medium transmits answers to questions posed to a god or spirit (exclude the use of animals for augury)",,,,,,,,,,,,,,,,,,,,,,,,,,,,,,,,,,,,,,,,,,,,,,,,,,,,,,,,,,,,,,,,,,,,,,,,,,,,,,,,,,,,,,,,,,,,,,,,,,,,,,,,,,,,,
476,Religion,Shrines,"Shrines, altars, ceremonial platforms, or other sacred places where religious practices (e.g., offerings, rituals, prayers) are regularly or repeatedly carried out",,,,,,,,,,,,,,,,,,,,,,,,,,,,,,,,,,,,,,,,,,,,,,,,,,,,,,,,,,,,,,,,,,,,,,,,,,,,,,,,,,,,,,,,,,,,,,,,,,,,,,,,,,,,,
477,Religion,Incense burned for ceremonial or ritual purposes,Incense burned for ceremonial or ritual purposes,,,,,,,,,,,,,,,,,,,,,,,,,,,,,,,,,,,,,,,,,,,,,,,,,,,,,,,,,,,,,,,,,,,,,,,,,,,,,,,,,,,,,,,,,,,,,,,,,,,,,,,,,,,,,
478,Religion,Ritual or liturgical texts,Ritual or liturgical (written) texts,,,,,,,,,,,,,,,,,,,,,,,,,,,,,,,,,,,,,,,,,,,,,,,,,,,,,,,,,,,,,,,,,,,,,,,,,,,,,,,,,,,,,,,,,,,,,,,,,,,,,,,,,,,,,
479,Religion,Special supernatural practitioners,"Special supernatural practitioners (e.g., shamans, diviners, priests, monks)",,,,,,,,,,,,,,,,,,,,,,,,,,,,,,,,,,,,,,,,,,,,,,,,,,,,,,,,,,,,,,,,,,,,,,,,,,,,,,,,,,,,,,,,,,,,,,,,,,,,,,,,,,,,,
480,Religion,Religious specialists supported by individuals or society,"Religious specialist(s) supported (fully or almost fully) by individuals, the community, tribe, or state",,,,,,,,,,,,,,,,,,,,,,,,,,,,,,,,,,,,,,,,,,,,,,,,,,,,,,,,,,,,,,,,,,,,,,,,,,,,,,,,,,,,,,,,,,,,,,,,,,,,,,,,,,,,,
481,Religion,Divination specialists consulted before important undertakings,"Specialists (e.g., astrologers) concerned exclusively with divination and related activities (exclude shamans) are consulted before undertakings important to the society or the political leader",,,,,,,,,,,,,,,,,,,,,,,,,,,,,,,,,,,,,,,,,,,,,,,,,,,,,,,,,,,,,,,,,,,,,,,,,,,,,,,,,,,,,,,,,,,,,,,,,,,,,,,,,,,,,
482,Religion,Priests,Priests: religious practitioners connected with specific gods or with society-wide ancestral cults,,,,,,,,,,,,,,,,,,,,,,,,,,,,,,,,,,,,,,,,,,,,,,,,,,,,,,,,,,,,,,,,,,,,,,,,,,,,,,,,,,,,,,,,,,,,,,,,,,,,,,,,,,,,,
483,Religion,Functionally specialized priests,"Functionally specialized priests (e.g., interpreters of oracles or dreams, sacrificial priests, funerary priests, war priests)",,,,,,,,,,,,,,,,,,,,,,,,,,,,,,,,,,,,,,,,,,,,,,,,,,,,,,,,,,,,,,,,,,,,,,,,,,,,,,,,,,,,,,,,,,,,,,,,,,,,,,,,,,,,,
484,Religion,Priests formally invested in their office,"Priests formally invested in their office by chief, king, or higher priest",,,,,,,,,,,,,,,,,,,,,,,,,,,,,,,,,,,,,,,,,,,,,,,,,,,,,,,,,,,,,,,,,,,,,,,,,,,,,,,,,,,,,,,,,,,,,,,,,,,,,,,,,,,,,
485,Religion,Head priest has considerable political influence,Head priest (including priest-chief or priest-king) has considerable political influence,,,,,,,,,,,,,,,,,,,,,,,,,,,,,,,,,,,,,,,,,,,,,,,,,,,,,,,,,,,,,,,,,,,,,,,,,,,,,,,,,,,,,,,,,,,,,,,,,,,,,,,,,,,,,
486,Religion,Hierarchy of priests,Hierarchy of priests,,,,,,,,,,,,,,,,,,,,,,,,,,,,,,,,,,,,,,,,,,,,,,,,,,,,,,,,,,,,,,,,,,,,,,,,,,,,,,,,,,,,,,,,,,,,,,,,,,,,,,,,,,,,,
487,Religion,Different orders of priests,Different orders of priests,,,,,,,,,,,,,,,,,,,,,,,,,,,,,,,,,,,,,,,,,,,,,,,,,,,,,,,,,,,,,,,,,,,,,,,,,,,,,,,,,,,,,,,,,,,,,,,,,,,,,,,,,,,,,
488,Religion,Women consecrated to a temple or a god service,"Women consecrated to a temple or to the service of a god (e.g., priestesses, virgins, nuns)",,,,,,,,,,,,,,,,,,,,,,,,,,,,,,,,,,,,,,,,,,,,,,,,,,,,,,,,,,,,,,,,,,,,,,,,,,,,,,,,,,,,,,,,,,,,,,,,,,,,,,,,,,,,,
489,Religion,Priests distinguished by visible status marks,"Priests or monks always distinguished by specific visible marks of their status (e.g., tonsure, special garments)",,,,,,,,,,,,,,,,,,,,,,,,,,,,,,,,,,,,,,,,,,,,,,,,,,,,,,,,,,,,,,,,,,,,,,,,,,,,,,,,,,,,,,,,,,,,,,,,,,,,,,,,,,,,,
490,Religion,Priests follow strict rules of discipline,"Priests or monks ordinarily follow strict rules of discipline, including various forms of abnegation (e.g., fasting, continence), purification, or mortification of the flesh",,,,,,,,,,,,,,,,,,,,,,,,,,,,,,,,,,,,,,,,,,,,,,,,,,,,,,,,,,,,,,,,,,,,,,,,,,,,,,,,,,,,,,,,,,,,,,,,,,,,,,,,,,,,,
491,Religion,Training school for priests,Training school for priests,,,,,,,,,,,,,,,,,,,,,,,,,,,,,,,,,,,,,,,,,,,,,,,,,,,,,,,,,,,,,,,,,,,,,,,,,,,,,,,,,,,,,,,,,,,,,,,,,,,,,,,,,,,,,
492,Religion,Temples,"Temple(s): structure(s), at least as large as dwellings, where priests worship gods or practice society-wide ancestral cults",,,,,,,,,,,,,,,,,,,,,,,,,,,,,,,,,,,,,,,,,,,,,,,,,,,,,,,,,,,,,,,,,,,,,,,,,,,,,,,,,,,,,,,,,,,,,,,,,,,,,,,,,,,,,
493,Religion,Temple has large staff,Temple has large staff of priests or attendants (more than 10),,,,,,,,,,,,,,,,,,,,,,,,,,,,,,,,,,,,,,,,,,,,,,,,,,,,,,,,,,,,,,,,,,,,,,,,,,,,,,,,,,,,,,,,,,,,,,,,,,,,,,,,,,,,,
