Trait_ID_6th,Category,Trait_name,Trait_description,,,,,,,,,,,,,,,,,,,,,,,,,,,,,,,,,,,,,,,,,,,,,,,,,,,,,,,,,,,,,,,,,,,,,,,,,,,,,,,,,,,,,,,,,,,,,,,,,,,,,,,,,,,,,
296,Political Organization,"Ministry of religious affairs, rites, or ceremonials","Ministry of religious affairs, rites, or ceremonials",,,,,,,,,,,,,,,,,,,,,,,,,,,,,,,,,,,,,,,,,,,,,,,,,,,,,,,,,,,,,,,,,,,,,,,,,,,,,,,,,,,,,,,,,,,,,,,,,,,,,,,,,,,,,
297,Political Organization,Ministry of foreign affairs,Ministry of foreign affairs,,,,,,,,,,,,,,,,,,,,,,,,,,,,,,,,,,,,,,,,,,,,,,,,,,,,,,,,,,,,,,,,,,,,,,,,,,,,,,,,,,,,,,,,,,,,,,,,,,,,,,,,,,,,,
298,Political Organization,Ministry of war,Ministry of war,,,,,,,,,,,,,,,,,,,,,,,,,,,,,,,,,,,,,,,,,,,,,,,,,,,,,,,,,,,,,,,,,,,,,,,,,,,,,,,,,,,,,,,,,,,,,,,,,,,,,,,,,,,,,
299,Political Organization,Prime minister,Prime minister: principal administrative official below the ruler who initiates or executes policy,,,,,,,,,,,,,,,,,,,,,,,,,,,,,,,,,,,,,,,,,,,,,,,,,,,,,,,,,,,,,,,,,,,,,,,,,,,,,,,,,,,,,,,,,,,,,,,,,,,,,,,,,,,,,
300,Political Organization,Council of ministers advising the ruler,Council of ministers forming a regular advisory body to the ruler,,,,,,,,,,,,,,,,,,,,,,,,,,,,,,,,,,,,,,,,,,,,,,,,,,,,,,,,,,,,,,,,,,,,,,,,,,,,,,,,,,,,,,,,,,,,,,,,,,,,,,,,,,,,,
301,Political Organization,Authentication devices for official actions,"Devices used to confirm or authenticate official orders, decrees, actions, and transactions (e.g., seals, signatures, rings, or other symbols)",,,,,,,,,,,,,,,,,,,,,,,,,,,,,,,,,,,,,,,,,,,,,,,,,,,,,,,,,,,,,,,,,,,,,,,,,,,,,,,,,,,,,,,,,,,,,,,,,,,,,,,,,,,,,
302,Political Organization,Auditing of government financial accounts,Auditing procedures to check for errors or embezzlement in government financial accounts,,,,,,,,,,,,,,,,,,,,,,,,,,,,,,,,,,,,,,,,,,,,,,,,,,,,,,,,,,,,,,,,,,,,,,,,,,,,,,,,,,,,,,,,,,,,,,,,,,,,,,,,,,,,,
303,Political Organization,Government budget,"Budget: a comprehensive and itemized estimate of anticipated revenues and expenditures, periodically prepared by government officials",,,,,,,,,,,,,,,,,,,,,,,,,,,,,,,,,,,,,,,,,,,,,,,,,,,,,,,,,,,,,,,,,,,,,,,,,,,,,,,,,,,,,,,,,,,,,,,,,,,,,,,,,,,,,
304,Political Organization,Annals of state affairs,Annals of state affairs regularly kept by official historian(s),,,,,,,,,,,,,,,,,,,,,,,,,,,,,,,,,,,,,,,,,,,,,,,,,,,,,,,,,,,,,,,,,,,,,,,,,,,,,,,,,,,,,,,,,,,,,,,,,,,,,,,,,,,,,
305,Political Organization,State archives,Archives in which official records and state papers are kept,,,,,,,,,,,,,,,,,,,,,,,,,,,,,,,,,,,,,,,,,,,,,,,,,,,,,,,,,,,,,,,,,,,,,,,,,,,,,,,,,,,,,,,,,,,,,,,,,,,,,,,,,,,,,
306,Political Organization,State officials paid a fixed salary,State officials paid a fixed salary,,,,,,,,,,,,,,,,,,,,,,,,,,,,,,,,,,,,,,,,,,,,,,,,,,,,,,,,,,,,,,,,,,,,,,,,,,,,,,,,,,,,,,,,,,,,,,,,,,,,,,,,,,,,,
307,Political Organization,Officials' salaries paid in currency,"Officials' salaries paid, at least in part, in currency rather than in kind",,,,,,,,,,,,,,,,,,,,,,,,,,,,,,,,,,,,,,,,,,,,,,,,,,,,,,,,,,,,,,,,,,,,,,,,,,,,,,,,,,,,,,,,,,,,,,,,,,,,,,,,,,,,,
308,Political Organization,Codified regulations for administrative structure,Codified regulations minutely govern the constitution and operation of the administrative structure,,,,,,,,,,,,,,,,,,,,,,,,,,,,,,,,,,,,,,,,,,,,,,,,,,,,,,,,,,,,,,,,,,,,,,,,,,,,,,,,,,,,,,,,,,,,,,,,,,,,,,,,,,,,,
309,Political Organization,Political leader is a full-time specialist,Political leader does not ordinarily engage in subsistence,,,,,,,,,,,,,,,,,,,,,,,,,,,,,,,,,,,,,,,,,,,,,,,,,,,,,,,,,,,,,,,,,,,,,,,,,,,,,,,,,,,,,,,,,,,,,,,,,,,,,,,,,,,,,
310,Political Organization,Political leader abstains from low-status activities,"Political leader may not engage in certain common economic activities, which are considered to be beneath his status",,,,,,,,,,,,,,,,,,,,,,,,,,,,,,,,,,,,,,,,,,,,,,,,,,,,,,,,,,,,,,,,,,,,,,,,,,,,,,,,,,,,,,,,,,,,,,,,,,,,,,,,,,,,,
311,Political Organization,Political leader entertains on a lavish scale,Political leader entertains on a lavish scale,,,,,,,,,,,,,,,,,,,,,,,,,,,,,,,,,,,,,,,,,,,,,,,,,,,,,,,,,,,,,,,,,,,,,,,,,,,,,,,,,,,,,,,,,,,,,,,,,,,,,,,,,,,,,
312,Political Organization,"Political leader bestows land, slaves, rank","Political leader bestows land, slaves, wealth, women, or noble rank for services rendered",,,,,,,,,,,,,,,,,,,,,,,,,,,,,,,,,,,,,,,,,,,,,,,,,,,,,,,,,,,,,,,,,,,,,,,,,,,,,,,,,,,,,,,,,,,,,,,,,,,,,,,,,,,,,
313,Political Organization,Political leader appoints officials,Political leader appoints and deposes subordinate political officials,,,,,,,,,,,,,,,,,,,,,,,,,,,,,,,,,,,,,,,,,,,,,,,,,,,,,,,,,,,,,,,,,,,,,,,,,,,,,,,,,,,,,,,,,,,,,,,,,,,,,,,,,,,,,
314,Political Organization,Political leader promulgates laws,"Political leader promulgates laws, issues decrees, or makes proclamations to the populace (not just orders that are obeyed)",,,,,,,,,,,,,,,,,,,,,,,,,,,,,,,,,,,,,,,,,,,,,,,,,,,,,,,,,,,,,,,,,,,,,,,,,,,,,,,,,,,,,,,,,,,,,,,,,,,,,,,,,,,,,
315,Political Organization,Political leader grants audiences ,Political leader grants formal audiences to hear grievances or petitions (exclude appeal in legal cases),,,,,,,,,,,,,,,,,,,,,,,,,,,,,,,,,,,,,,,,,,,,,,,,,,,,,,,,,,,,,,,,,,,,,,,,,,,,,,,,,,,,,,,,,,,,,,,,,,,,,,,,,,,,,
316,Political Organization,Political leader travels around the kingdom,"Political leader makes regular visits to various parts of the kingdom to examine conditions, hear cases, collect taxes, awe his subjects, etc.",,,,,,,,,,,,,,,,,,,,,,,,,,,,,,,,,,,,,,,,,,,,,,,,,,,,,,,,,,,,,,,,,,,,,,,,,,,,,,,,,,,,,,,,,,,,,,,,,,,,,,,,,,,,,
317,Political Organization,Political leader travels with a retinue,Political leader travels with a retinue,,,,,,,,,,,,,,,,,,,,,,,,,,,,,,,,,,,,,,,,,,,,,,,,,,,,,,,,,,,,,,,,,,,,,,,,,,,,,,,,,,,,,,,,,,,,,,,,,,,,,,,,,,,,,
318,Political Organization,Political leader controls religious institutions,"Political leader exercises considerable control over the activities of temples or the church (e.g., performs investiture of priests, endows temples)",,,,,,,,,,,,,,,,,,,,,,,,,,,,,,,,,,,,,,,,,,,,,,,,,,,,,,,,,,,,,,,,,,,,,,,,,,,,,,,,,,,,,,,,,,,,,,,,,,,,,,,,,,,,,
319,Political Organization,Political leader performs essential societal rituals,"Political leader performs rituals considered essential for the welfare of the society, and which only he can perform",,,,,,,,,,,,,,,,,,,,,,,,,,,,,,,,,,,,,,,,,,,,,,,,,,,,,,,,,,,,,,,,,,,,,,,,,,,,,,,,,,,,,,,,,,,,,,,,,,,,,,,,,,,,,
320,Political Organization,Installation ceremony for political leader ,"Special ceremony for installation or investiture of new political leader (e.g., oath of office, coronation)",,,,,,,,,,,,,,,,,,,,,,,,,,,,,,,,,,,,,,,,,,,,,,,,,,,,,,,,,,,,,,,,,,,,,,,,,,,,,,,,,,,,,,,,,,,,,,,,,,,,,,,,,,,,,
321,Political Organization,Political leader has special symbols of office,"Political leader has special symbols of office or authority (e.g., throne, crown, scepter, seal, robes)",,,,,,,,,,,,,,,,,,,,,,,,,,,,,,,,,,,,,,,,,,,,,,,,,,,,,,,,,,,,,,,,,,,,,,,,,,,,,,,,,,,,,,,,,,,,,,,,,,,,,,,,,,,,,
322,Political Organization,Deference to political leader,"Displays of special deference to political leader (e.g., carrying in a litter, averting the eyes, bowing)",,,,,,,,,,,,,,,,,,,,,,,,,,,,,,,,,,,,,,,,,,,,,,,,,,,,,,,,,,,,,,,,,,,,,,,,,,,,,,,,,,,,,,,,,,,,,,,,,,,,,,,,,,,,,
323,Political Organization,Officials or sub-chiefs swear allegiance to the leader,"Officials, vassals, sub-chiefs, or courtiers swear allegiance to the chief, king, or state",,,,,,,,,,,,,,,,,,,,,,,,,,,,,,,,,,,,,,,,,,,,,,,,,,,,,,,,,,,,,,,,,,,,,,,,,,,,,,,,,,,,,,,,,,,,,,,,,,,,,,,,,,,,,
324,Political Organization,Political leader addressed by honorific titles,Political leader addressed or referred to by various honorific titles,,,,,,,,,,,,,,,,,,,,,,,,,,,,,,,,,,,,,,,,,,,,,,,,,,,,,,,,,,,,,,,,,,,,,,,,,,,,,,,,,,,,,,,,,,,,,,,,,,,,,,,,,,,,,
325,Political Organization,Lese majesty severely punished,"Lese majesty — an offense against the dignity, person, or property of the ruler — severely punished",,,,,,,,,,,,,,,,,,,,,,,,,,,,,,,,,,,,,,,,,,,,,,,,,,,,,,,,,,,,,,,,,,,,,,,,,,,,,,,,,,,,,,,,,,,,,,,,,,,,,,,,,,,,,
326,Political Organization,(Semi)divine ruler,"Ruler is considered divine, semi-divine, or sacred, or traces his descent from a god",,,,,,,,,,,,,,,,,,,,,,,,,,,,,,,,,,,,,,,,,,,,,,,,,,,,,,,,,,,,,,,,,,,,,,,,,,,,,,,,,,,,,,,,,,,,,,,,,,,,,,,,,,,,,
327,Political Organization,Political leader buried with wealth,Political leader buried with large amounts of wealth,,,,,,,,,,,,,,,,,,,,,,,,,,,,,,,,,,,,,,,,,,,,,,,,,,,,,,,,,,,,,,,,,,,,,,,,,,,,,,,,,,,,,,,,,,,,,,,,,,,,,,,,,,,,,
328,Political Organization,Political leader buried with wives or slaves,"Wives, concubines, retainers, or slaves of political leader buried with him or otherwise killed at the time of his death",,,,,,,,,,,,,,,,,,,,,,,,,,,,,,,,,,,,,,,,,,,,,,,,,,,,,,,,,,,,,,,,,,,,,,,,,,,,,,,,,,,,,,,,,,,,,,,,,,,,,,,,,,,,,
329,Political Organization,Political leader elaborately buried,"Political leader buried in an elaborate tomb or grave (e.g., burial mound, cist grave, thatched building, pyramid)",,,,,,,,,,,,,,,,,,,,,,,,,,,,,,,,,,,,,,,,,,,,,,,,,,,,,,,,,,,,,,,,,,,,,,,,,,,,,,,,,,,,,,,,,,,,,,,,,,,,,,,,,,,,,
330,Political Organization,Special treatment to preserve leader’s corpse,"Special treatment (e.g., desiccation, embalming) to preserve the political leader’s corpse or part thereof (not just the bones)",,,,,,,,,,,,,,,,,,,,,,,,,,,,,,,,,,,,,,,,,,,,,,,,,,,,,,,,,,,,,,,,,,,,,,,,,,,,,,,,,,,,,,,,,,,,,,,,,,,,,,,,,,,,,
331,Political Organization,Deceased political leader reverenced,"Deceased former political leader especially reverenced (e.g., his spirit invoked or propitiated, monuments erected to his memory)",,,,,,,,,,,,,,,,,,,,,,,,,,,,,,,,,,,,,,,,,,,,,,,,,,,,,,,,,,,,,,,,,,,,,,,,,,,,,,,,,,,,,,,,,,,,,,,,,,,,,,,,,,,,,
332,Political Organization,"Ruler receives food and goods as gifts, tribute or taxes","Chief or king receives large amounts of food and/or other goods as gifts, tribute, taxes, or fines",,,,,,,,,,,,,,,,,,,,,,,,,,,,,,,,,,,,,,,,,,,,,,,,,,,,,,,,,,,,,,,,,,,,,,,,,,,,,,,,,,,,,,,,,,,,,,,,,,,,,,,,,,,,,
333,Political Organization,Special residence for political leader,Political leader lives in a special residence or compound categorically superior to any other residence,,,,,,,,,,,,,,,,,,,,,,,,,,,,,,,,,,,,,,,,,,,,,,,,,,,,,,,,,,,,,,,,,,,,,,,,,,,,,,,,,,,,,,,,,,,,,,,,,,,,,,,,,,,,,
334,Political Organization,Royal estates,"Royal estates, residences, or preserves outside the capital which are the property of the ruler",,,,,,,,,,,,,,,,,,,,,,,,,,,,,,,,,,,,,,,,,,,,,,,,,,,,,,,,,,,,,,,,,,,,,,,,,,,,,,,,,,,,,,,,,,,,,,,,,,,,,,,,,,,,,
335,Political Organization,Full-time retainers for political leader,Political leader has full-time personal attendants or retainers,,,,,,,,,,,,,,,,,,,,,,,,,,,,,,,,,,,,,,,,,,,,,,,,,,,,,,,,,,,,,,,,,,,,,,,,,,,,,,,,,,,,,,,,,,,,,,,,,,,,,,,,,,,,,
336,Political Organization,Royal household maintained by a steward and staff,Royal or chiefly household maintained by a steward and staff,,,,,,,,,,,,,,,,,,,,,,,,,,,,,,,,,,,,,,,,,,,,,,,,,,,,,,,,,,,,,,,,,,,,,,,,,,,,,,,,,,,,,,,,,,,,,,,,,,,,,,,,,,,,,
337,Political Organization,Court,"Court, a body of officials, members of the upper classes, retainers, entertainers, etc., surrounding the chief or king",,,,,,,,,,,,,,,,,,,,,,,,,,,,,,,,,,,,,,,,,,,,,,,,,,,,,,,,,,,,,,,,,,,,,,,,,,,,,,,,,,,,,,,,,,,,,,,,,,,,,,,,,,,,,
338,Political Organization,Ruler has significantly more wives or concubines,Chief or king has significantly more wives or concubines than anyone else,,,,,,,,,,,,,,,,,,,,,,,,,,,,,,,,,,,,,,,,,,,,,,,,,,,,,,,,,,,,,,,,,,,,,,,,,,,,,,,,,,,,,,,,,,,,,,,,,,,,,,,,,,,,,
339,Political Organization,Ruler has a harem,"Chief or king has a harem (a special residence(s) supervised by a responsible official(s), e.g., a eunuch)",,,,,,,,,,,,,,,,,,,,,,,,,,,,,,,,,,,,,,,,,,,,,,,,,,,,,,,,,,,,,,,,,,,,,,,,,,,,,,,,,,,,,,,,,,,,,,,,,,,,,,,,,,,,,
340,Political Organization,Ruler has a bodyguard,Bodyguard to protect the ruler’s person,,,,,,,,,,,,,,,,,,,,,,,,,,,,,,,,,,,,,,,,,,,,,,,,,,,,,,,,,,,,,,,,,,,,,,,,,,,,,,,,,,,,,,,,,,,,,,,,,,,,,,,,,,,,,
341,Political Organization,Private tutors for children of nobles,Private tutors retained at court to instruct prince(s) and/or children of nobles,,,,,,,,,,,,,,,,,,,,,,,,,,,,,,,,,,,,,,,,,,,,,,,,,,,,,,,,,,,,,,,,,,,,,,,,,,,,,,,,,,,,,,,,,,,,,,,,,,,,,,,,,,,,,
342,Political Organization,Political leader has storehouse or treasury,"Political leader has storehouse or treasury (for hard goods or valuables, rather than for food)",,,,,,,,,,,,,,,,,,,,,,,,,,,,,,,,,,,,,,,,,,,,,,,,,,,,,,,,,,,,,,,,,,,,,,,,,,,,,,,,,,,,,,,,,,,,,,,,,,,,,,,,,,,,,
343,Political Organization,Formal treaties between societies ,"Formal treaties (recorded or witnessed and sworn) concluded between societies to establish alliances, to settle disputes, or to end wars",,,,,,,,,,,,,,,,,,,,,,,,,,,,,,,,,,,,,,,,,,,,,,,,,,,,,,,,,,,,,,,,,,,,,,,,,,,,,,,,,,,,,,,,,,,,,,,,,,,,,,,,,,,,,
344,Political Organization,Ambassadors,Ambassador(s): diplomatic representative acting in regular relations with a foreign government,,,,,,,,,,,,,,,,,,,,,,,,,,,,,,,,,,,,,,,,,,,,,,,,,,,,,,,,,,,,,,,,,,,,,,,,,,,,,,,,,,,,,,,,,,,,,,,,,,,,,,,,,,,,,
345,Political Organization,Diplomatic missions,Diplomatic missions by government officials carried out for specific purposes,,,,,,,,,,,,,,,,,,,,,,,,,,,,,,,,,,,,,,,,,,,,,,,,,,,,,,,,,,,,,,,,,,,,,,,,,,,,,,,,,,,,,,,,,,,,,,,,,,,,,,,,,,,,,
346,Political Organization,"Passports, visas, or tallies","Passports, visas, or tallies to control the entry or exit of persons, native or foreign",,,,,,,,,,,,,,,,,,,,,,,,,,,,,,,,,,,,,,,,,,,,,,,,,,,,,,,,,,,,,,,,,,,,,,,,,,,,,,,,,,,,,,,,,,,,,,,,,,,,,,,,,,,,,
347,Political Organization,Superordinate tribe or state,"Superordinate tribe or state which receives tribute, labor, soldiers, or other recognition of obligation from subordinate or vassal tribe(s) or state(s)",,,,,,,,,,,,,,,,,,,,,,,,,,,,,,,,,,,,,,,,,,,,,,,,,,,,,,,,,,,,,,,,,,,,,,,,,,,,,,,,,,,,,,,,,,,,,,,,,,,,,,,,,,,,,
348,Political Organization,Resident officials overseeing native rulers of subordinate states,Resident political officials who oversee native rulers of feudatory or tributary states,,,,,,,,,,,,,,,,,,,,,,,,,,,,,,,,,,,,,,,,,,,,,,,,,,,,,,,,,,,,,,,,,,,,,,,,,,,,,,,,,,,,,,,,,,,,,,,,,,,,,,,,,,,,,
349,Law and Judicial Process,Composition,Composition: redress of death or bodily injury by payment of an indemnity to the victim or his relatives (with or without a formal judicial proceeding),,,,,,,,,,,,,,,,,,,,,,,,,,,,,,,,,,,,,,,,,,,,,,,,,,,,,,,,,,,,,,,,,,,,,,,,,,,,,,,,,,,,,,,,,,,,,,,,,,,,,,,,,,,,,
350,Law and Judicial Process,Ordeals or oaths to establish guilt or settle disputes,Ordeals or oaths to establish guilt or innocence or to settle disputes prescribed or enforced (exclude torture applied to extract a confession),,,,,,,,,,,,,,,,,,,,,,,,,,,,,,,,,,,,,,,,,,,,,,,,,,,,,,,,,,,,,,,,,,,,,,,,,,,,,,,,,,,,,,,,,,,,,,,,,,,,,,,,,,,,,
351,Law and Judicial Process,Mediation used to settle inter-community disputes,Mediation or formal legal procedure customarily used to settle at least one type of dispute within the political unit,,,,,,,,,,,,,,,,,,,,,,,,,,,,,,,,,,,,,,,,,,,,,,,,,,,,,,,,,,,,,,,,,,,,,,,,,,,,,,,,,,,,,,,,,,,,,,,,,,,,,,,,,,,,,
352,Law and Judicial Process,Land disputes settled by political or judicial authority,"Disputes over land settled by political or judicial authority, rather than only by mediation or fighting",,,,,,,,,,,,,,,,,,,,,,,,,,,,,,,,,,,,,,,,,,,,,,,,,,,,,,,,,,,,,,,,,,,,,,,,,,,,,,,,,,,,,,,,,,,,,,,,,,,,,,,,,,,,,
353,Law and Judicial Process,Judicial process,"Judicial process, in which an individual or limited group (e.g., council of elders, tribal chief, court of law) considers evidence and renders judgment in a dispute, or of an accused person, on behalf of the society",,,,,,,,,,,,,,,,,,,,,,,,,,,,,,,,,,,,,,,,,,,,,,,,,,,,,,,,,,,,,,,,,,,,,,,,,,,,,,,,,,,,,,,,,,,,,,,,,,,,,,,,,,,,,
354,Law and Judicial Process,Court trials,"Court trials, held under specialized judges or magistrates who hear testimony and weigh evidence, interpret the law or customary law, and render a decision in civil or criminal cases",,,,,,,,,,,,,,,,,,,,,,,,,,,,,,,,,,,,,,,,,,,,,,,,,,,,,,,,,,,,,,,,,,,,,,,,,,,,,,,,,,,,,,,,,,,,,,,,,,,,,,,,,,,,,
355,Law and Judicial Process,Judicial system of higher and lower courts,"Judicial system of higher and lower courts, cases being referred to one or the other according to their nature, with decisions of lower courts perhaps appealable to higher courts",,,,,,,,,,,,,,,,,,,,,,,,,,,,,,,,,,,,,,,,,,,,,,,,,,,,,,,,,,,,,,,,,,,,,,,,,,,,,,,,,,,,,,,,,,,,,,,,,,,,,,,,,,,,,
356,Law and Judicial Process,Specialized courts,"Specialized courts (e.g., commercial courts, military courts, ecclesiastical courts, divorce courts)",,,,,,,,,,,,,,,,,,,,,,,,,,,,,,,,,,,,,,,,,,,,,,,,,,,,,,,,,,,,,,,,,,,,,,,,,,,,,,,,,,,,,,,,,,,,,,,,,,,,,,,,,,,,,
357,Law and Judicial Process,Legal counsel,Legal counsel: specialized advocates or lawyers who interpret the law or act for clients in legal cases,,,,,,,,,,,,,,,,,,,,,,,,,,,,,,,,,,,,,,,,,,,,,,,,,,,,,,,,,,,,,,,,,,,,,,,,,,,,,,,,,,,,,,,,,,,,,,,,,,,,,,,,,,,,,
358,Law and Judicial Process,Oaths or affirmations of truthful testimony,Oaths or affirmations of truthful testimony required of witnesses in legal trials,,,,,,,,,,,,,,,,,,,,,,,,,,,,,,,,,,,,,,,,,,,,,,,,,,,,,,,,,,,,,,,,,,,,,,,,,,,,,,,,,,,,,,,,,,,,,,,,,,,,,,,,,,,,,
359,Law and Judicial Process,Oaths of compurgation accepted as evidence of innocence,Oaths of compurgation accepted as evidence of innocence at legal trials,,,,,,,,,,,,,,,,,,,,,,,,,,,,,,,,,,,,,,,,,,,,,,,,,,,,,,,,,,,,,,,,,,,,,,,,,,,,,,,,,,,,,,,,,,,,,,,,,,,,,,,,,,,,,
360,Law and Judicial Process,Perjury or false testimony punishable by law,Perjury or false testimony in court legal cases punishable by law,,,,,,,,,,,,,,,,,,,,,,,,,,,,,,,,,,,,,,,,,,,,,,,,,,,,,,,,,,,,,,,,,,,,,,,,,,,,,,,,,,,,,,,,,,,,,,,,,,,,,,,,,,,,,
361,Law and Judicial Process,Judges,Judges: officials whose sole function it is to apply the law and render decisions in civil or criminal cases,,,,,,,,,,,,,,,,,,,,,,,,,,,,,,,,,,,,,,,,,,,,,,,,,,,,,,,,,,,,,,,,,,,,,,,,,,,,,,,,,,,,,,,,,,,,,,,,,,,,,,,,,,,,,
362,Law and Judicial Process,Police,"Police: specialized individual or force charged with keeping the peace, enforcement of norms, or the apprehension and detention of offenders",,,,,,,,,,,,,,,,,,,,,,,,,,,,,,,,,,,,,,,,,,,,,,,,,,,,,,,,,,,,,,,,,,,,,,,,,,,,,,,,,,,,,,,,,,,,,,,,,,,,,,,,,,,,,
363,Law and Judicial Process,Specialized public executioner,Specialized public executioner,,,,,,,,,,,,,,,,,,,,,,,,,,,,,,,,,,,,,,,,,,,,,,,,,,,,,,,,,,,,,,,,,,,,,,,,,,,,,,,,,,,,,,,,,,,,,,,,,,,,,,,,,,,,,
364,Law and Judicial Process,Law,"Law: a body of explicitly formulated secular norms, interpreted, applied, and enforced by a constituted authority",,,,,,,,,,,,,,,,,,,,,,,,,,,,,,,,,,,,,,,,,,,,,,,,,,,,,,,,,,,,,,,,,,,,,,,,,,,,,,,,,,,,,,,,,,,,,,,,,,,,,,,,,,,,,
365,Law and Judicial Process,Recurrent decrees of laws,Laws recurrently decreed by a ruler or enacted by a legislative body,,,,,,,,,,,,,,,,,,,,,,,,,,,,,,,,,,,,,,,,,,,,,,,,,,,,,,,,,,,,,,,,,,,,,,,,,,,,,,,,,,,,,,,,,,,,,,,,,,,,,,,,,,,,,
366,Law and Judicial Process,Code of laws,"Code of laws (explicit and recorded) which covers social, political, and/or economic relations",,,,,,,,,,,,,,,,,,,,,,,,,,,,,,,,,,,,,,,,,,,,,,,,,,,,,,,,,,,,,,,,,,,,,,,,,,,,,,,,,,,,,,,,,,,,,,,,,,,,,,,,,,,,,
367,Law and Judicial Process,Offenses against persons punishable by law,"Offenses against persons (e.g., sorcery — if actually practiced, assault, maiming, rape, murder) punishable under law or custom by formal means",,,,,,,,,,,,,,,,,,,,,,,,,,,,,,,,,,,,,,,,,,,,,,,,,,,,,,,,,,,,,,,,,,,,,,,,,,,,,,,,,,,,,,,,,,,,,,,,,,,,,,,,,,,,,
368,Law and Judicial Process,Offenses against property punishable by law,"Offenses against property (e.g., theft, arson, willful or inadvertent destruction) subject to indemnification or punishment under law or custom by formal means",,,,,,,,,,,,,,,,,,,,,,,,,,,,,,,,,,,,,,,,,,,,,,,,,,,,,,,,,,,,,,,,,,,,,,,,,,,,,,,,,,,,,,,,,,,,,,,,,,,,,,,,,,,,,
369,Law and Judicial Process,Obstruction of justice punishable under law,"Obstruction of justice (e.g., harboring of criminals, refusing to give evidence) punishable under law",,,,,,,,,,,,,,,,,,,,,,,,,,,,,,,,,,,,,,,,,,,,,,,,,,,,,,,,,,,,,,,,,,,,,,,,,,,,,,,,,,,,,,,,,,,,,,,,,,,,,,,,,,,,,
370,Law and Judicial Process,"Laws governing marriage, abortion, or adoption","Laws governing marriage, divorce, abortion, infanticide, or adoption",,,,,,,,,,,,,,,,,,,,,,,,,,,,,,,,,,,,,,,,,,,,,,,,,,,,,,,,,,,,,,,,,,,,,,,,,,,,,,,,,,,,,,,,,,,,,,,,,,,,,,,,,,,,,
371,Law and Judicial Process,Laws governing inheritance,Laws governing inheritance,,,,,,,,,,,,,,,,,,,,,,,,,,,,,,,,,,,,,,,,,,,,,,,,,,,,,,,,,,,,,,,,,,,,,,,,,,,,,,,,,,,,,,,,,,,,,,,,,,,,,,,,,,,,,
372,Law and Judicial Process,"Laziness, malingering, or vagrancy punishable by law","Laziness, malingering, or vagrancy punishable by law",,,,,,,,,,,,,,,,,,,,,,,,,,,,,,,,,,,,,,,,,,,,,,,,,,,,,,,,,,,,,,,,,,,,,,,,,,,,,,,,,,,,,,,,,,,,,,,,,,,,,,,,,,,,,
373,Law and Judicial Process,"Libel, slander, or malicious lying punishable by law","Libel, slander, or malicious lying punishable by law",,,,,,,,,,,,,,,,,,,,,,,,,,,,,,,,,,,,,,,,,,,,,,,,,,,,,,,,,,,,,,,,,,,,,,,,,,,,,,,,,,,,,,,,,,,,,,,,,,,,,,,,,,,,,
374,Law and Judicial Process,Laws regulating borrowing and lending,Laws regulating borrowing and lending,,,,,,,,,,,,,,,,,,,,,,,,,,,,,,,,,,,,,,,,,,,,,,,,,,,,,,,,,,,,,,,,,,,,,,,,,,,,,,,,,,,,,,,,,,,,,,,,,,,,,,,,,,,,,
375,Law and Judicial Process,Building codes,"Building codes: laws regulating house construction (e.g., prescribing building materials, limiting number of stories)",,,,,,,,,,,,,,,,,,,,,,,,,,,,,,,,,,,,,,,,,,,,,,,,,,,,,,,,,,,,,,,,,,,,,,,,,,,,,,,,,,,,,,,,,,,,,,,,,,,,,,,,,,,,,
376,Law and Judicial Process,Sacrilege severely punished,"Sacrilege — irreverence or disrespect toward a sacred person, place, custom, or object — severely punished",,,,,,,,,,,,,,,,,,,,,,,,,,,,,,,,,,,,,,,,,,,,,,,,,,,,,,,,,,,,,,,,,,,,,,,,,,,,,,,,,,,,,,,,,,,,,,,,,,,,,,,,,,,,,
377,Law and Judicial Process,Religious law enforced by political officials,Religious law enforced by political officials,,,,,,,,,,,,,,,,,,,,,,,,,,,,,,,,,,,,,,,,,,,,,,,,,,,,,,,,,,,,,,,,,,,,,,,,,,,,,,,,,,,,,,,,,,,,,,,,,,,,,,,,,,,,,
378,Law and Judicial Process,Statute of limitations,Statute of limitations specifying the time within which offenders must be brought to trial to be punishable,,,,,,,,,,,,,,,,,,,,,,,,,,,,,,,,,,,,,,,,,,,,,,,,,,,,,,,,,,,,,,,,,,,,,,,,,,,,,,,,,,,,,,,,,,,,,,,,,,,,,,,,,,,,,
379,Law and Judicial Process,Offenses punished by a designated agent rather than by the offended party,Most offenses regularly punished by a designated or permanent agent of the society rather than by the offended parties themselves,,,,,,,,,,,,,,,,,,,,,,,,,,,,,,,,,,,,,,,,,,,,,,,,,,,,,,,,,,,,,,,,,,,,,,,,,,,,,,,,,,,,,,,,,,,,,,,,,,,,,,,,,,,,,
380,Law and Judicial Process,Crimes punishable by public authorities only,Crimes legally punishable by public authorities only; private action illegal,,,,,,,,,,,,,,,,,,,,,,,,,,,,,,,,,,,,,,,,,,,,,,,,,,,,,,,,,,,,,,,,,,,,,,,,,,,,,,,,,,,,,,,,,,,,,,,,,,,,,,,,,,,,,
381,Law and Judicial Process,Offenses punished by fines,"Certain offenses punished by fines (in currency or in kind) paid to the lineage, sib or village, tribe or state, of which part may go to the offended party (including penalty feasts)",,,,,,,,,,,,,,,,,,,,,,,,,,,,,,,,,,,,,,,,,,,,,,,,,,,,,,,,,,,,,,,,,,,,,,,,,,,,,,,,,,,,,,,,,,,,,,,,,,,,,,,,,,,,,
382,Law and Judicial Process,Offenses punished by confiscation of property,"Certain offenses punished by confiscation of property, of which part may go to the offended party",,,,,,,,,,,,,,,,,,,,,,,,,,,,,,,,,,,,,,,,,,,,,,,,,,,,,,,,,,,,,,,,,,,,,,,,,,,,,,,,,,,,,,,,,,,,,,,,,,,,,,,,,,,,,
383,Law and Judicial Process,Political authority retains fines or confiscated property,Fines collected or property confiscated by political authority and not shared with the offended party (unless he is the political leader),,,,,,,,,,,,,,,,,,,,,,,,,,,,,,,,,,,,,,,,,,,,,,,,,,,,,,,,,,,,,,,,,,,,,,,,,,,,,,,,,,,,,,,,,,,,,,,,,,,,,,,,,,,,,
384,Law and Judicial Process,Corporal punishment,"Corporal punishment (including mutilation, shaving off hair) meted out for certain offenses by an authorized agent of the society (other than the offended party or his kin unless he is the political leader)",,,,,,,,,,,,,,,,,,,,,,,,,,,,,,,,,,,,,,,,,,,,,,,,,,,,,,,,,,,,,,,,,,,,,,,,,,,,,,,,,,,,,,,,,,,,,,,,,,,,,,,,,,,,,
385,Law and Judicial Process,Incarceration of convicted offenders,"Incarceration of convicted offenders (in shackles, stocks, pens, cages, or prisons)",,,,,,,,,,,,,,,,,,,,,,,,,,,,,,,,,,,,,,,,,,,,,,,,,,,,,,,,,,,,,,,,,,,,,,,,,,,,,,,,,,,,,,,,,,,,,,,,,,,,,,,,,,,,,
386,Law and Judicial Process,Offenses punished by slavery or hard labor,Certain offenses punished by slavery or by terms at hard labor,,,,,,,,,,,,,,,,,,,,,,,,,,,,,,,,,,,,,,,,,,,,,,,,,,,,,,,,,,,,,,,,,,,,,,,,,,,,,,,,,,,,,,,,,,,,,,,,,,,,,,,,,,,,,
387,Law and Judicial Process,Death penalty,"Death penalty decreed by custom or after judicial procedure for certain crimes, and exacted openly by someone acting with the explicit approval of the society",,,,,,,,,,,,,,,,,,,,,,,,,,,,,,,,,,,,,,,,,,,,,,,,,,,,,,,,,,,,,,,,,,,,,,,,,,,,,,,,,,,,,,,,,,,,,,,,,,,,,,,,,,,,,
388,Law and Judicial Process,Commutation of certain sentences upon payment,Commutation of sentences for certain crimes may be granted upon payment of a fixed amount,,,,,,,,,,,,,,,,,,,,,,,,,,,,,,,,,,,,,,,,,,,,,,,,,,,,,,,,,,,,,,,,,,,,,,,,,,,,,,,,,,,,,,,,,,,,,,,,,,,,,,,,,,,,,
389,Law and Judicial Process,Political leader sometimes pardons convicted offenders,Political leader sometimes pardons convicted offenders,,,,,,,,,,,,,,,,,,,,,,,,,,,,,,,,,,,,,,,,,,,,,,,,,,,,,,,,,,,,,,,,,,,,,,,,,,,,,,,,,,,,,,,,,,,,,,,,,,,,,,,,,,,,,
